<?xml version="1.0" encoding="ISO-8859-1"?>

<!ELEMENT ControlInfo (Description,EUnit*, PunchPattern*)>
<!ATTLIST ControlInfo
 Name CDATA #IMPLIED
 X_Coordinate CDATA #IMPLIED
 Y_Coordinate CDATA #IMPLIED 
 X_TextOffset CDATA #IMPLIED
 Y_TextOffset CDATA #IMPLIED
 FreeText     CDATA #IMPLIED
 ModifyDate   CDATA #IMPLIED
>

<!ELEMENT Description (Box*)>
<!ELEMENT Box (Symbol | Text)?>

<!ATTLIST Box
  column  (A|B|C|D|E|F|G|H)  #REQUIRED
  hasDiagonal (Y|N) "N"
>

<!ELEMENT Symbol EMPTY>
<!ATTLIST Symbol 
  Order    CDATA #REQUIRED
  Id       CDATA #REQUIRED
>

<!ELEMENT Text (#PCDATA)>
<!ATTLIST Text
  Order    CDATA #REQUIRED
>
 
<!ATTLIST Description
  ModifyDate CDATA #IMPLIED
>

<!ELEMENT EUnit EMPTY> 
<!ATTLIST EUnit
  UnitCode   CDATA #REQUIRED
  Type       CDATA #REQUIRED
  ModifyDate CDATA #IMPLIED
>

<!ELEMENT PunchPattern (#PCDATA)>
